[
  {
    "systemName": "ROSETTE SECTOR EL-Y D15",
    "bodyName": "2 B",
    "latitude": -3.3269,
    "longitude": 139.8931,
    "count": 1,
    "cmdrName": "Galactic Fork",
    "cmdrComment": "Nothing special here",
    "isBeta": false,
    "reportStatus": "pending"
  },
  {
    "systemName": "CALIFORNIA SECTOR DL-Y D4",
    "bodyName": "C 2",
    "latitude": 17.29,
    "longitude": -108.53,
    "count": 2,
    "cmdrName": "PanPiper",
    "cmdrComment": "Something kind of special here",
    "isBeta": false,
    "reportStatus": "pending"
  },
  {
    "systemName": "HIP 23759",
    "bodyName": "8 D A",
    "latitude": -24.78,
    "longitude": 125.81,
    "count": 3,
    "cmdrName": "PanPiper",
    "cmdrComment": "Something very special here",
    "isBeta": true,
    "reportStatus": "pending"
  }
]
